<?xml version="1.0" encoding="UTF-8"?>

<timedautomata name="GossipPush"
	xmlns:xsi="http://www.w3.org/2001/XMLSchema-instance"
	xsi:noNamespaceSchemaLocation="http://www.labri.fr/~fmoranda/xsd/ta.xsd">

	<state name="init" initial="true" urgent="true" action=BasicActions$InitEnv>
		<path guard="BasicGuards$True" to="mailbox" />
		<spawn name="heart_beat" />
		<spawn name="clean_beat" />
	</state>

	<state name="mailbox" urgent="true" action="BasicActions$SaveMailBox" >
		<path guard="MailBoxGuards$MailBoxIsNotEmpty" to="pop_mailbox" />
		<path guard="BasicGuards$True"  to="wait_next_any_msg" />
	</state>

	<state name="pop_mailbox" urgent="true" >
		<path guard="MailBoxGuards$PopAndIsHelloMsg" to="add_to_hello_set" />
		<path guard="MailBoxGuards$PopAndIsDataMsg" 	to="add_to_data_set" />
		<path guard="BasicGuards$True"  to="wait_next_any_msg" />
	</state>

	<state name="wait_next_any_msg" urgent="false">
		<path guard="BasicGuards$True" to="mailbox" />
	</state>

	<state name="add_to_hello_set" action="HelloActions$AddToHelloSet"
		urgent="true">
		<path guard="BasicGuards$True" to="pop_mailbox" />
	</state>

	<state name="add_to_data_set" action="DataActions$AddToDataSet"
		urgent="true">
		<path guard="BasicGuards$True" to="broadcast_data_msg" />
	</state>

	<state name="broadcast_data_msg" urgent="true" action="GossipPushActions$DecreaseTTL">
		<path guard="GossipPushGuards$ShouldForwardMsg" to="forward_msg_now" />
		<path guard="BasicGuards$True"  to="pop_mailbox" />
	</state>

	<state name="forward_msg_now" action="GossipPushActions$ForwardMsgToRandomNeighbors"
		urgent="true">
		<path guard="BasicGuards$True" to="pop_mailbox" />
	</state>

	<timedautomata name="heart_beat">
		<state name="init" initial="true">
			<path guard="BasicGuards$False" to="init" timeout="10" />
			<timeout to="send_state" />
		</state>
		<state name="send_state" action="HelloActions$SendHello">
			<path guard="BasicGuards$True" to="init" />
		</state>
	</timedautomata>

	<timedautomata name="clean_beat">
		<state name="init" initial="true">
			<path guard="BasicGuards$False" to="init" timeout="45" />
			<timeout to="clean_state" />
		</state>
		<state name="clean_state" action="HelloActions$CleanHelloSet">
			<path guard="BasicGuards$True" to="init" />
		</state>
	</timedautomata>

</timedautomata>